{
  "schema_version": "1.0.0",
  "record_type": "source",
  "urls": [
    "https://pubmed.ncbi.nlm.nih.gov/31191974/"
  ],
  "access_status": "abstract_only_available",
  "access_depth": "abstract_only",
  "access_attempts": [
    {
      "attempted_at": "2026-06-06T14:25:00Z",
      "url": "https://pubmed.ncbi.nlm.nih.gov/31191974/",
      "result": "PubMed abstract and metadata accessed via NCBI E-utilities.",
      "notes": "Extraction uses abstract-level results for this baseline pass."
    }
  ],
  "id": "carter-sildenafil-hypoxia-exercise-review-2019",
  "name": "Sildenafil does not reliably improve exercise performance in hypoxia: a systematic review.",
  "source_type": "systematic_review_meta_analysis",
  "authors": [
    "Carter EA",
    "Lohse K",
    "Sheel W",
    "Koehle M"
  ],
  "venue": "BMJ Open Sport and Exercise Medicine",
  "year": 2019,
  "published_on": "2019-03-29",
  "doi": "10.1136/bmjsem-2019-000526",
  "pmid": "31191974",
  "summary": "Systematic review and meta-analysis of 14 randomized placebo-controlled crossover sildenafil studies in healthy humans under hypoxia, assessing pulmonary artery pressure, cardiac output, oxygen saturation, and exercise performance."
}
