{
  "schema_version": "1.0.0",
  "record_type": "source",
  "urls": [
    "https://pubmed.ncbi.nlm.nih.gov/28972192/"
  ],
  "access_status": "abstract_only_available",
  "access_depth": "abstract_only",
  "access_attempts": [
    {
      "attempted_at": "2026-06-06T14:25:00Z",
      "url": "https://pubmed.ncbi.nlm.nih.gov/28972192/",
      "result": "PubMed abstract and metadata accessed via NCBI E-utilities.",
      "notes": "Extraction uses abstract-level results for this baseline pass."
    }
  ],
  "id": "victor-tadalafil-dmd-phase3-2017",
  "name": "A phase 3 randomized placebo-controlled trial of tadalafil for Duchenne muscular dystrophy.",
  "source_type": "randomized_trial",
  "authors": [
    "Victor RG",
    "Sweeney HL",
    "Finkel R",
    "McDonald CM",
    "Byrne B",
    "Eagle M",
    "Goemans N",
    "Vandenborne K",
    "Dubrovsky AL",
    "Topaloglu H",
    "Tadalafil DMD Study Group"
  ],
  "venue": "Neurology",
  "year": 2017,
  "published_on": "2017-09-29",
  "doi": "10.1212/WNL.0000000000004570",
  "pmid": "28972192",
  "registry_ids": [
    "NCT01865084"
  ],
  "summary": "Phase 3 randomized placebo-controlled trial in 331 glucocorticoid-treated boys with Duchenne muscular dystrophy, testing tadalafil 0.3 or 0.6 mg/kg/day versus placebo for 48 weeks on 6-minute walk distance and secondary ambulatory function outcomes."
}
