{
  "schema_version": "1.0.0",
  "record_type": "source",
  "id": "sample-source-example-topic-2026",
  "name": "Synthetic Sample Source For Example Topic",
  "source_type": "fixture_report",
  "authors": [
    "Evidence Workbench Fixture"
  ],
  "venue": "Local Test Fixture",
  "year": 2026,
  "published_on": "2026-05-31",
  "urls": [
    "https://example.com/sample-research/example-topic"
  ],
  "summary": "Synthetic source metadata used only to test file-backed workflow mechanics."
}
