{
  "schema_version": "1.0.0",
  "record_type": "source",
  "id": "olmestig-etlas2-main-2025",
  "name": "Tadalafil Treatment in Patients With Cerebral Small Vessel Disease: The ETLAS-2 Randomized Clinical Trial.",
  "source_type": "randomized_trial",
  "authors": [
    "Olmestig J",
    "Mortensen KN",
    "Thomas MB",
    "Fagerlund B",
    "Naveed N",
    "Nordling MM",
    "Nielsen MKK",
    "Rasmussen BS",
    "Christensen H",
    "Iversen HK",
    "Poulsen MB",
    "Siebner HR",
    "Kruuse C"
  ],
  "venue": "Stroke",
  "year": 2025,
  "published_on": "2025-07-28",
  "doi": "10.1161/STROKEAHA.125.051602",
  "pmid": "40718899",
  "registry_ids": [
    "NCT05173896"
  ],
  "urls": [
    "https://pubmed.ncbi.nlm.nih.gov/40718899/",
    "https://pmc.ncbi.nlm.nih.gov/articles/PMC12447817/",
    "https://clinicaltrials.gov/study/NCT05173896"
  ],
  "summary": "Phase II randomized placebo-controlled ETLAS-2 trial testing daily tadalafil 20 mg for 3 months in patients with cerebral small vessel disease and previous stroke or transient ischemic attack, reporting feasibility, cognition, imaging, blood pressure, and adverse events.",
  "access_status": "full_text_available",
  "access_depth": "full_text",
  "access_attempts": [
    {
      "attempted_at": "2026-06-05T23:31:00Z",
      "url": "https://pubmed.ncbi.nlm.nih.gov/40718899/",
      "result": "PubMed abstract and PMC full-text links available.",
      "notes": "Used PubMed abstract and metadata for staged extraction."
    }
  ]
}
