{
  "schema_version": "1.0.0",
  "record_type": "source",
  "urls": [
    "https://pubmed.ncbi.nlm.nih.gov/22318947/"
  ],
  "access_status": "abstract_only_available",
  "access_depth": "abstract_only",
  "access_attempts": [
    {
      "attempted_at": "2026-06-06T14:25:00Z",
      "url": "https://pubmed.ncbi.nlm.nih.gov/22318947/",
      "result": "PubMed abstract and metadata accessed via NCBI E-utilities.",
      "notes": "Extraction uses abstract-level results for this baseline pass."
    }
  ],
  "id": "diluigi-tadalafil-hpa-exercise-2012",
  "name": "The phosphodiesterases type 5 inhibitor tadalafil reduces the activation of the hypothalamus-pituitary-adrenal axis in men during cycle ergometric exercise.",
  "source_type": "randomized_crossover_trial",
  "authors": [
    "Di Luigi L",
    "Sgro P",
    "Baldari C",
    "Gallotta MC",
    "Emerenziani GP",
    "Crescioli C",
    "Bianchini S",
    "Romanelli F",
    "Lenzi A",
    "Guidetti L"
  ],
  "venue": "American Journal of Physiology-Endocrinology and Metabolism",
  "year": 2012,
  "published_on": "2012-02-07",
  "doi": "10.1152/ajpendo.00573.2011",
  "pmid": "22318947",
  "summary": "Double-blind crossover trial in 14 healthy males testing two tadalafil 20 mg doses over 36 hours before maximal cycle exercise, measuring exercise performance/cardiorespiratory parameters and endocrine stress-axis responses."
}
