{
  "schema_version": "1.0.0",
  "record_type": "source",
  "id": "djagba-ngss-classroom-augmentation-2026-source",
  "name": "Exploring Data Augmentation and Resampling Strategies for Transformer-Based Models to Address Class Imbalance in AI Scoring of Scientific Explanations in NGSS Classroom",
  "source_type": "conference_preprint",
  "authors": [
    "Prudence Djagba",
    "Kevin Haudek",
    "Clare G.C. Franovic",
    "Leonora Kaldaras"
  ],
  "venue": "NARST 2026 / arXiv",
  "year": 2026,
  "doi": "10.48550/arXiv.2604.19754",
  "urls": [
    "https://arxiv.org/abs/2604.19754",
    "https://arxiv.org/pdf/2604.19754"
  ],
  "summary": "NARST 2026 conference preprint on class imbalance in AI scoring of high school NGSS scientific explanations. The study uses GPT-generated synthetic student responses, EASE, and ALP augmentation to improve transformer-based classification of rubric categories and explicitly calls for further validity work and expert quality checks.",
  "access_status": "full_text_verified",
  "access_depth": "full_text",
  "access_attempts": [
    {
      "attempted_at": "2026-06-03T11:02:00Z",
      "url": "https://arxiv.org/abs/2604.19754",
      "result": "verified",
      "notes": "arXiv metadata, authors, abstract, DOI, conference note, and PDF link verified."
    },
    {
      "attempted_at": "2026-06-03T11:03:00Z",
      "url": "https://arxiv.org/pdf/2604.19754",
      "result": "verified",
      "notes": "PDF downloaded and text extracted locally."
    }
  ]
}
