{
  "schema_version": "1.0.0",
  "record_type": "source",
  "id": "seftel-tadalafil-confidence-sear-2009",
  "name": "Improvements in confidence, sexual relationship and satisfaction measures: results of a randomized trial of tadalafil 5 mg taken once daily.",
  "source_type": "randomized_trial",
  "authors": [
    "Seftel AD",
    "Buvat J",
    "Althof SE",
    "McMurray JG",
    "Zeigler HL",
    "Burns PR",
    "Wong DG"
  ],
  "venue": "International Journal of Impotence Research",
  "year": 2009,
  "published_on": "2009-06-18",
  "doi": "10.1038/ijir.2009.22",
  "pmid": "19536128",
  "urls": [
    "https://pubmed.ncbi.nlm.nih.gov/19536128/",
    "https://www.nature.com/articles/ijir200922"
  ],
  "summary": "Randomized placebo-controlled 12-week tadalafil 5 mg once-daily erectile-dysfunction trial reporting sexual satisfaction and psychosocial measures including the Self-Esteem And Relationship questionnaire.",
  "access_status": "abstract_only_paywalled",
  "access_depth": "abstract_only",
  "access_attempts": [
    {
      "attempted_at": "2026-06-06T12:17:00Z",
      "url": "https://www.nature.com/articles/ijir200922",
      "result": "Article page and abstract accessed; full article behind Springer Nature access controls.",
      "notes": "Extraction uses the article abstract and PubMed metadata."
    }
  ]
}
