{
  "schema_version": "1.0.0",
  "record_type": "source",
  "id": "ncbi-livertox-pde5-inhibitors-overview-2017",
  "name": "Phosphodiesterase Type 5 (PDE5) Inhibitors - LiverTox overview",
  "source_type": "ncbi_bookshelf_class_overview",
  "authors": [
    "National Institute of Diabetes and Digestive and Kidney Diseases"
  ],
  "venue": "LiverTox: Clinical and Research Information on Drug-Induced Liver Injury",
  "year": 2017,
  "published_on": "2017-08-02",
  "urls": [
    "https://www.ncbi.nlm.nih.gov/books/NBK548192/"
  ],
  "summary": "NCBI Bookshelf class overview stating that PDE5 inhibitors block cGMP breakdown and prolong nitric-oxide mediated vasodilation, with sildenafil, tadalafil, vardenafil, and avanafil approved for ED.",
  "access_status": "full_text_verified",
  "access_depth": "full_text",
  "access_attempts": [
    {
      "attempted_at": "2026-06-06T11:36:00Z",
      "url": "https://www.ncbi.nlm.nih.gov/books/NBK548192/",
      "result": "Full NCBI Bookshelf overview accessed.",
      "notes": "Used overview lines on shared class mechanism, approved PDE5 inhibitors, and uncertainty about whether some rare safety signals are class effects or agent-specific."
    }
  ]
}
