{
  "schema_version": "1.0.0",
  "record_type": "source",
  "id": "dailymed-stendra-label-2024-07",
  "name": "DailyMed STENDRA avanafil tablet prescribing information",
  "source_type": "regulatory_label",
  "authors": [
    "Metuchen Pharmaceuticals, LLC",
    "U.S. National Library of Medicine DailyMed"
  ],
  "venue": "DailyMed",
  "year": 2024,
  "published_on": "2024-07-18",
  "urls": [
    "https://dailymed.nlm.nih.gov/dailymed/drugInfo.cfm?setid=fa7d93e3-b69b-4e02-8146-89760cd8e9d6"
  ],
  "summary": "U.S. STENDRA label updated July 18, 2024, covering avanafil dosing, nitrate and GC-stimulator contraindications, alpha-blocker/antihypertensive/alcohol cautions, PDE selectivity, nitrate timing, and pharmacokinetics.",
  "access_status": "full_text_verified",
  "access_depth": "full_text",
  "access_attempts": [
    {
      "attempted_at": "2026-06-06T11:35:00Z",
      "url": "https://dailymed.nlm.nih.gov/dailymed/drugInfo.cfm?setid=fa7d93e3-b69b-4e02-8146-89760cd8e9d6",
      "result": "Full prescribing information accessed through DailyMed.",
      "notes": "Used label sections 2, 4, 5, 7, and 12 for class-transfer extraction."
    }
  ]
}
